smartctl 6.2 2017-02-27 r4394 [x86_64-linux-3.10.0-693.5.2.el7.x86_64] (local build)
Copyright (C) 2002-13, Bruce Allen, Christian Franke, www.smartmontools.org

=== START OF READ SMART DATA SECTION ===
SMART Attributes Data Structure revision number: 10
Vendor Specific SMART Attributes with Thresholds:
ID# ATTRIBUTE_NAME          FLAG     VALUE WORST THRESH TYPE      UPDATED  WHEN_FAILED RAW_VALUE
  1 Raw_Read_Error_Rate     0x000f   114   099   006    Pre-fail  Always       -       79537400
  3 Spin_Up_Time            0x0003   097   097   000    Pre-fail  Always       -       0
  4 Start_Stop_Count        0x0032   100   100   020    Old_age   Always       -       84
  5 Reallocated_Sector_Ct   0x0033   100   100   036    Pre-fail  Always       -       0
  7 Seek_Error_Rate         0x000f   081   060   030    Pre-fail  Always       -       147928526
  9 Power_On_Hours          0x0032   049   049   000    Old_age   Always       -       45081
 10 Spin_Retry_Count        0x0013   100   100   097    Pre-fail  Always       -       0
 12 Power_Cycle_Count       0x0032   100   100   020    Old_age   Always       -       42
183 Runtime_Bad_Block       0x0032   100   100   000    Old_age   Always       -       0
184 End-to-End_Error        0x0032   100   100   099    Old_age   Always       -       0
187 Reported_Uncorrect      0x0032   100   100   000    Old_age   Always       -       0
188 Command_Timeout         0x0032   100   099   000    Old_age   Always       -       0 0 4
189 High_Fly_Writes         0x003a   100   100   000    Old_age   Always       -       0
190 Airflow_Temperature_Cel 0x0022   076   053   045    Old_age   Always       -       24 (Min/Max 21/30)
194 Temperature_Celsius     0x0022   024   047   000    Old_age   Always       -       24 (0 17 0 0 0)
195 Hardware_ECC_Recovered  0x001a   020   015   000    Old_age   Always       -       79537400
197 Current_Pending_Sector  0x0012   100   100   000    Old_age   Always       -       0
198 Offline_Uncorrectable   0x0010   100   100   000    Old_age   Offline      -       0
199 UDMA_CRC_Error_Count    0x003e   200   200   000    Old_age   Always       -       0
240 Head_Flying_Hours       0x0000   100   253   000    Old_age   Offline      -       44981h+38m+22.284s
241 Total_LBAs_Written      0x0000   100   253   000    Old_age   Offline      -       1998537628
242 Total_LBAs_Read         0x0000   100   253   000    Old_age   Offline      -       356701522

